{
  "$schema": "http://json-schema.org/draft-07/schema#",
  "title": "GroundingInspectorFixture",
  "type": "object",
  "required": ["fixture_id", "source", "ai_output", "claims", "groundedness", "scorecard"],
  "additionalProperties": false,
  "properties": {
    "fixture_id": { "type": "string" },
    "source": {
      "type": "object",
      "required": ["title", "sections"],
      "additionalProperties": false,
      "properties": {
        "title": { "type": "string" },
        "sections": {
          "type": "array",
          "items": {
            "type": "object",
            "required": ["id", "page", "char_start", "char_end", "text"],
            "additionalProperties": false,
            "properties": {
              "id": { "type": "string" },
              "page": { "type": "integer", "minimum": 1 },
              "char_start": { "type": "integer", "minimum": 0 },
              "char_end": { "type": "integer", "minimum": 0 },
              "text": { "type": "string" }
            }
          }
        }
      }
    },
    "ai_output": { "type": "string" },
    "claims": {
      "type": "array",
      "items": {
        "type": "object",
        "required": ["id", "text", "label", "evidence_span_ids", "quote", "page", "rationale"],
        "additionalProperties": false,
        "properties": {
          "id": { "type": "string" },
          "text": { "type": "string" },
          "label": { "enum": ["grounded", "partial", "unsupported"] },
          "evidence_span_ids": { "type": "array", "items": { "type": "string" } },
          "quote": { "type": ["string", "null"] },
          "page": { "type": ["integer", "null"] },
          "rationale": { "type": "string" }
        }
      }
    },
    "groundedness": {
      "type": "object",
      "required": ["score", "n_grounded", "n_partial", "n_unsupported"],
      "additionalProperties": false,
      "properties": {
        "score": { "type": "integer", "minimum": 0, "maximum": 100 },
        "n_grounded": { "type": "integer", "minimum": 0 },
        "n_partial": { "type": "integer", "minimum": 0 },
        "n_unsupported": { "type": "integer", "minimum": 0 }
      }
    },
    "scorecard": {
      "type": "object",
      "required": ["recall", "recall_ci", "false_negatives", "n_positive", "validated_on", "domain_note", "pipeline_commit", "verifier_model", "source_sha256"],
      "additionalProperties": false,
      "properties": {
        "recall": { "type": "number", "minimum": 0, "maximum": 1 },
        "recall_ci": {
          "type": "array", "minItems": 2, "maxItems": 2,
          "items": { "type": "number", "minimum": 0, "maximum": 1 }
        },
        "false_negatives": { "type": "integer", "minimum": 0 },
        "n_positive": { "type": "integer", "minimum": 0 },
        "balanced_accuracy": { "type": ["number", "null"], "minimum": 0, "maximum": 1 },
        "citation_precision": { "type": ["number", "null"], "minimum": 0, "maximum": 1 },
        "cohen_kappa": { "type": ["number", "null"] },
        "validated_on": { "type": "string" },
        "domain_note": { "type": "string" },
        "pipeline_commit": { "type": "string" },
        "verifier_model": { "type": "string" },
        "source_sha256": { "type": "string" }
      }
    },
    "omissions": {
      "type": "array",
      "$comment": "global_score is NOT comparable across methods. Both are max(section score), but the section score means different things: embedkde's is an unbounded KDE density ratio (higher = more anomalous, no fixed upper bound), while comprehensiveness_qa's is a 0-1 fraction of source subclaims judged OMITTED. Never rank, sort, average or threshold global_score across entries with different `method` values.",
      "items": {
        "type": "object",
        "if": {
          "properties": { "method": { "const": "comprehensiveness_qa" } },
          "required": ["method"]
        },
        "then": {
          "required": ["method", "global_score", "flagged_sections", "hyperparameters", "validated", "caveat"],
          "additionalProperties": false,
          "properties": {
            "method": { "const": "comprehensiveness_qa" },
            "global_score": { "type": "number" },
            "flagged_sections": {
              "type": "array",
              "items": {
                "type": "object",
                "required": ["section_id", "score", "omitted_facts"],
                "additionalProperties": false,
                "properties": {
                  "section_id": { "type": "string" },
                  "score": { "type": "number" },
                  "omitted_facts": {
                    "type": "array",
                    "items": {
                      "type": "object",
                      "required": ["fact", "question", "evidence"],
                      "properties": {
                        "fact": { "type": "string" },
                        "question": { "type": "string" },
                        "evidence": { "type": ["string", "null"] }
                      }
                    }
                  }
                }
              }
            },
            "hyperparameters": { "type": "object" },
            "validated": { "type": "boolean" },
            "caveat": { "type": "string" }
          }
        },
        "else": {
          "required": ["method", "global_score", "flagged_sections", "hyperparameters", "validated", "caveat"],
          "additionalProperties": false,
          "properties": {
            "method": { "enum": ["embedkde"] },
            "global_score": { "type": "number" },
            "flagged_sections": {
              "type": "array",
              "items": {
                "type": "object",
                "required": ["section_id", "score", "top_tokens"],
                "additionalProperties": false,
                "properties": {
                  "section_id": { "type": "string" },
                  "score": { "type": "number" },
                  "top_tokens": { "type": "array", "items": { "type": "string" } }
                }
              }
            },
            "hyperparameters": { "type": "object" },
            "validated": { "type": "boolean" },
            "caveat": { "type": "string" }
          }
        }
      }
    }
  }
}
