{
  "fixture_id": "travel-pds-01",
  "source": {
    "title": "SunSafe Travel Insurance \u2014 Product Disclosure Statement (synthetic)",
    "sections": [
      {
        "id": "s1",
        "page": 1,
        "char_start": 0,
        "char_end": 120,
        "text": "SunSafe Travel Insurance PDS. This document sets out what is and is not covered."
      },
      {
        "id": "s4_2",
        "page": 12,
        "char_start": 0,
        "char_end": 140,
        "text": "Overseas medical expenses are covered up to $10,000,000 for emergency treatment while travelling."
      },
      {
        "id": "s7_1",
        "page": 22,
        "char_start": 0,
        "char_end": 150,
        "text": "Baggage and personal effects are covered subject to a sub-limit of $1,000 per item and $5,000 in total."
      },
      {
        "id": "s9",
        "page": 30,
        "char_start": 0,
        "char_end": 120,
        "text": "Exclusions: claims arising from extreme sports, war, or pre-existing conditions are not payable."
      }
    ]
  },
  "ai_output": "This policy is excellent value for money and the best choice for families. Overseas medical is covered up to $10,000,000. Individual lost items are covered up to $5,000 each.",
  "claims": [
    {
      "id": "c1",
      "text": "This policy is excellent value for money and the best choice for families.",
      "label": "unsupported",
      "evidence_span_ids": [],
      "quote": null,
      "page": null,
      "rationale": "No value-for-money or suitability judgment exists anywhere in the PDS."
    },
    {
      "id": "c2",
      "text": "Overseas medical is covered up to $10,000,000.",
      "label": "grounded",
      "evidence_span_ids": [
        "s4_2"
      ],
      "quote": "covered up to $10,000,000",
      "page": 12,
      "rationale": "Section s4_2 states exactly this limit."
    },
    {
      "id": "c3",
      "text": "Individual lost items are covered up to $5,000 each.",
      "label": "partial",
      "evidence_span_ids": [
        "s7_1"
      ],
      "quote": "sub-limit of $1,000 per item",
      "page": 22,
      "rationale": "Baggage is covered, but the per-item limit is $1,000, not $5,000; the claim overstates it."
    }
  ],
  "groundedness": {
    "score": 50,
    "n_grounded": 1,
    "n_partial": 1,
    "n_unsupported": 1
  },
  "scorecard": {
    "recall": 0.69,
    "recall_ci": [
      0.59,
      0.779
    ],
    "false_negatives": 31,
    "n_positive": 100,
    "balanced_accuracy": 0.612,
    "citation_precision": null,
    "cohen_kappa": 0.195,
    "validated_on": "RAGTruth (sampled, n=300, seed=0)",
    "domain_note": "benchmark distribution; NOT measured on PDS",
    "pipeline_commit": "1814f83",
    "verifier_model": "flan-t5-large",
    "source_sha256": "37141be876d122894df5fe8fb2d9702667cd77c3811ee660d6ccf75061e452db"
  },
  "omissions": [
    {
      "method": "embedkde",
      "global_score": 0.8765827047580934,
      "flagged_sections": [],
      "hyperparameters": {
        "pca_components": 16,
        "kde_bandwidth": 1.0,
        "threshold_std": 1.5
      },
      "validated": false,
      "caveat": "Omission signals are unvalidated: no ground-truth omission labels exist for these fixtures, and detection hyperparameters (PCA components, KDE bandwidth, per-document threshold) are unadjusted defaults, not calibrated against labeled data. Treat a flagged span as a prompt to review the source directly, not a finding."
    },
    {
      "method": "comprehensiveness_qa",
      "global_score": 1.0,
      "flagged_sections": [
        {
          "section_id": "s9",
          "score": 1.0,
          "omitted_facts": [
            {
              "fact": "SYNTHETIC TEST DATA -- not from a real API call. See Task 9 of docs/superpowers/plans/2026-08-19-grounding-inspector-comprehensiveness-recall-qa.md.",
              "question": "Does the output mention this fact?",
              "evidence": null
            }
          ]
        }
      ],
      "hyperparameters": { "model": "claude-sonnet-4-5-20250929", "flag_threshold": 0.0 },
      "validated": false,
      "caveat": "Comprehensiveness signals are unvalidated: no ground-truth omission labels exist for these fixtures, and flag_threshold (any single OMITTED fact flags its section) is an unadjusted default -- a single LLM misjudgment among many subclaims can flag a section. Treat a flagged span as a prompt to review the source directly, not a finding."
    }
  ]
}