{
  "fixture_id": "travel-pds-02",
  "source": {
    "title": "SunSafe Travel Insurance \u2014 Product Disclosure Statement (synthetic)",
    "sections": [
      {
        "id": "s1",
        "page": 1,
        "char_start": 0,
        "char_end": 110,
        "text": "SunSafe Travel Insurance PDS. This document sets out what is and is not covered."
      },
      {
        "id": "s5_1",
        "page": 16,
        "char_start": 0,
        "char_end": 160,
        "text": "Travel delay: if your scheduled departure is delayed by more than 6 hours due to a covered event, you may claim up to $200 per day to a maximum of $1,000."
      },
      {
        "id": "s5_2",
        "page": 17,
        "char_start": 0,
        "char_end": 155,
        "text": "Trip cancellation: we will reimburse non-refundable prepaid travel costs if you cancel for a covered reason, up to $10,000 per person."
      },
      {
        "id": "s9",
        "page": 30,
        "char_start": 0,
        "char_end": 130,
        "text": "Exclusions: claims arising from changes of mind, strike action known before booking, or financial collapse of a carrier are not covered."
      }
    ]
  },
  "ai_output": "If your flight is delayed, SunSafe covers up to $200 per day with no cap on the number of days. Trip cancellation is covered up to $10,000 per person for non-refundable costs. Strike action is always covered, regardless of when it was announced. The policy covers all travel delays, even those caused by the airline's own mechanical failures.",
  "claims": [
    {
      "id": "c1",
      "text": "If your flight is delayed, SunSafe covers up to $200 per day with no cap on the number of days.",
      "label": "partial",
      "evidence_span_ids": [
        "s5_1"
      ],
      "quote": "up to $200 per day to a maximum of $1,000",
      "page": 16,
      "rationale": "The $200/day rate is correct, but the claim omits the $1,000 total cap \u2014 implying unlimited daily cover."
    },
    {
      "id": "c2",
      "text": "Trip cancellation is covered up to $10,000 per person for non-refundable costs.",
      "label": "grounded",
      "evidence_span_ids": [
        "s5_2"
      ],
      "quote": "up to $10,000 per person",
      "page": 17,
      "rationale": "Section s5_2 states exactly this limit for non-refundable prepaid costs."
    },
    {
      "id": "c3",
      "text": "Strike action is always covered, regardless of when it was announced.",
      "label": "unsupported",
      "evidence_span_ids": [],
      "quote": null,
      "page": null,
      "rationale": "Section s9 explicitly excludes strike action known before booking. The claim is the opposite of the policy."
    },
    {
      "id": "c4",
      "text": "The policy covers all travel delays, even those caused by the airline's own mechanical failures.",
      "label": "grounded",
      "evidence_span_ids": [
        "s5_1"
      ],
      "quote": "delayed by more than 6 hours due to a covered event",
      "page": 16,
      "rationale": "Mechanical failure is a covered event; the 6-hour threshold and daily cap apply but the type of cause is not excluded."
    }
  ],
  "groundedness": {
    "score": 63,
    "n_grounded": 2,
    "n_partial": 1,
    "n_unsupported": 1
  },
  "scorecard": {
    "recall": 0.69,
    "recall_ci": [
      0.59,
      0.779
    ],
    "false_negatives": 31,
    "n_positive": 100,
    "balanced_accuracy": 0.612,
    "citation_precision": null,
    "cohen_kappa": 0.195,
    "validated_on": "RAGTruth (sampled, n=300, seed=0)",
    "domain_note": "benchmark distribution; NOT measured on PDS",
    "pipeline_commit": "1814f83",
    "verifier_model": "flan-t5-large",
    "source_sha256": "e335f8fe11471ec4dac11248dde3cd0e3615091fca051f69116730e1b66814a6"
  },
  "omissions": [
    {
      "method": "embedkde",
      "global_score": 0.6977833580926439,
      "flagged_sections": [],
      "hyperparameters": {
        "pca_components": 16,
        "kde_bandwidth": 1.0,
        "threshold_std": 1.5
      },
      "validated": false,
      "caveat": "Omission signals are unvalidated: no ground-truth omission labels exist for these fixtures, and detection hyperparameters (PCA components, KDE bandwidth, per-document threshold) are unadjusted defaults, not calibrated against labeled data. Treat a flagged span as a prompt to review the source directly, not a finding."
    },
    {
      "method": "comprehensiveness_qa",
      "global_score": 1.0,
      "flagged_sections": [
        {
          "section_id": "s1",
          "score": 0.5,
          "omitted_facts": [
            {
              "fact": "The document is titled or identified as 'SunSafe Travel Insurance PDS'",
              "question": "Does the document identify itself as 'SunSafe Travel Insurance PDS' or contain this phrase as its title?",
              "evidence": null
            },
            {
              "fact": "The document contains information about what is not covered",
              "question": "What information does the document contain about what is not covered?",
              "evidence": null
            }
          ]
        },
        {
          "section_id": "s5_1",
          "score": 0.8,
          "omitted_facts": [
            {
              "fact": "The delay threshold that triggers eligibility is more than 6 hours",
              "question": "What is the delay threshold in hours that triggers eligibility?",
              "evidence": null
            },
            {
              "fact": "The delay must be to a scheduled departure",
              "question": "Does the document state that the delay must be to a scheduled departure?",
              "evidence": null
            },
            {
              "fact": "The delay must be due to a covered event",
              "question": "Does the document state that the delay must be due to a covered event?",
              "evidence": null
            },
            {
              "fact": "The maximum total claimable amount is $1,000",
              "question": "What is the maximum total claimable amount?",
              "evidence": null
            }
          ]
        },
        {
          "section_id": "s5_2",
          "score": 0.5,
          "omitted_facts": [
            {
              "fact": "The reimbursement applies to prepaid costs",
              "question": "Does the document state that the reimbursement applies to prepaid costs?",
              "evidence": null
            },
            {
              "fact": "The reimbursement applies to travel costs",
              "question": "Does the document state that the reimbursement applies to travel costs?",
              "evidence": null
            },
            {
              "fact": "Reimbursement requires cancellation for a covered reason",
              "question": "Does the document state that reimbursement requires cancellation for a covered reason?",
              "evidence": null
            }
          ]
        },
        {
          "section_id": "s9",
          "score": 1.0,
          "omitted_facts": [
            {
              "fact": "Changes of mind generate claims that are excluded from coverage",
              "question": "Does the document state that changes of mind generate claims that are excluded from coverage?",
              "evidence": null
            },
            {
              "fact": "Strike action known before booking generates claims that are excluded from coverage",
              "question": "Does the policy exclude coverage for claims arising from strike action that was known before the booking was made?",
              "evidence": null
            },
            {
              "fact": "The strike action must have been known before the booking was made for the exclusion to apply",
              "question": "Does the policy exclusion require that the strike action was known or could reasonably have been known before the booking was made?",
              "evidence": null
            },
            {
              "fact": "Financial collapse of a carrier generates claims that are excluded from coverage",
              "question": "Does the document state that claims resulting from a carrier's financial collapse are excluded from coverage?",
              "evidence": null
            },
            {
              "fact": "The excluded financial collapse must be of a carrier (transport provider)",
              "question": "Does the document state that the excluded financial collapse must be of a carrier or transport provider?",
              "evidence": null
            }
          ]
        }
      ],
      "hyperparameters": {
        "model": "claude-sonnet-4-5-20250929",
        "flag_threshold": 0.0
      },
      "validated": false,
      "caveat": "Comprehensiveness signals are unvalidated: no ground-truth omission labels exist for these fixtures, and flag_threshold (any single OMITTED fact flags its section) is an unadjusted default -- a single LLM misjudgment among many subclaims can flag a section. Treat a flagged span as a prompt to review the source directly, not a finding. AI-generated summaries are typically much shorter than their source documents and will legitimately omit most source facts by construction -- a high flag rate reflects this, not necessarily a detector fault."
    }
  ]
}